review_id,review_text,rating,sentiment_score
1,Purpose boy job cup decision girl now get job yard. Great service Great service Great service,4.5,0
2,Prevent production able both the box school way issue grow action figure one. Food was cold Food was cold Food was cold,2.1,-4
3,Family station listen agreement more kitchen lose hour hour. Driver was polite Driver was polite Driver was polite,4.5,2
4,World north people area everything enter beyond Democrat beautiful very. Driver was polite Driver was polite Driver was polite,2.6,4
5,Hand way yourself tax whether sister anyone effect fact hospital dream party. Highly recommend Highly recommend Highly recommend,3.6,3
6,Receive establish toward wonder writer thus teacher this job training pull professional buy. Driver was polite Driver was polite Driver was polite,1.9,3
7,Check public Democrat them between property write. Driver was polite Driver was polite Driver was polite,3.3,3
8,Prove movement event identify company force machine himself experience. Driver was polite Driver was polite Driver was polite,1.5,3
9,Suddenly enjoy memory maintain guess good senior service important likely daughter drive hard. Highly recommend Highly recommend Highly recommend,2.8,3
10,Drive process accept owner statement role camera although stock rise he reason blood. Awful delay Awful delay Awful delay,2.5,-6
11,Plant quite support grow hope politics under film involve. The delivery was fast! The delivery was fast! The delivery was fast!,2.5,4
12,Official Democrat good recognize less perhaps. Driver was polite Driver was polite Driver was polite,2.9,3
13,Sure audience ground need give particularly situation carry. Highly recommend Highly recommend Highly recommend,4.6,3
14,Create eat walk reveal nice career teach language model probably computer. Food was cold Food was cold Food was cold,2.6,-2
15,Build late customer position dog our anything either including society nation. Highly recommend Highly recommend Highly recommend,3.6,3
16,Occur memory thank reason campaign certainly class. Awful delay Awful delay Awful delay,1.8,-6
17,Statement without part deep improve week least these ask provide trial force compare. The delivery was fast! The delivery was fast! The delivery was fast!,3.8,4
18,Opportunity technology say hot together since decide listen after reflect success city from. Awful delay Awful delay Awful delay,2,-4
19,Individual politics price necessary Republican factor continue senior every. Food was cold Food was cold Food was cold,4.7,-3
20,Animal to who book research us condition skin baby watch enjoy today. Awful delay Awful delay Awful delay,3.6,-5
21,Animal partner crime rock full office national federal heart serve day. Awful delay Awful delay Awful delay,2.3,-7
22,Admit read cause do word help. The delivery was fast! The delivery was fast! The delivery was fast!,3.8,3
23,Low far general easy mind will from. Food was cold Food was cold Food was cold,1.9,-2
24,Nor color wear pay way same economy above prevent. Great service Great service Great service,2.2,0
25,Lead shoulder town major start successful stand catch people feel person. Driver was polite Driver was polite Driver was polite,1.1,5
26,Increase young ball probably yet set onto size computer plan hear. Food was cold Food was cold Food was cold,1.3,-3
27,Discuss reveal magazine news commercial wear Democrat interesting first behavior along more college. Driver was polite Driver was polite Driver was polite,4.6,3
28,Lawyer certain do response nearly body. Food was cold Food was cold Food was cold,4.8,-3
29,Street wide support begin better many situation. Driver was polite Driver was polite Driver was polite,2.2,4
30,Discover deal more worker bar generation dog medical. Driver was polite Driver was polite Driver was polite,2.4,3
31,Always style reflect yeah parent ten such. Great service Great service Great service,3.8,0
32,Simply together edge week able just control car focus reason. The delivery was fast! The delivery was fast! The delivery was fast!,1.5,3
33,Entire official along must lead rest sit rock yet those player. The delivery was fast! The delivery was fast! The delivery was fast!,1.6,4
34,Call decision since compare popular mother sing. Driver was polite Driver was polite Driver was polite,4.7,4
35,Among early affect environmental house off unit bring. Awful delay Awful delay Awful delay,1.8,-6
36,Available pick usually evening news give appear likely change reveal work. Food was cold Food was cold Food was cold,2.4,-3
37,Anyone century pattern claim half possible culture involve seem wait language age source. The delivery was fast! The delivery was fast! The delivery was fast!,3.4,3
38,This degree than through seat thought report all. Food was cold Food was cold Food was cold,2.4,-3
39,Party compare do lot return number need amount final mean key. Great service Great service Great service,2.5,0
40,Discussion series ball paper seem gas. Awful delay Awful delay Awful delay,3.1,-6
41,Talk audience city paper nearly movie money herself. Awful delay Awful delay Awful delay,4.3,-6
42,Contain PM dinner forward book sort man account upon without religious at. Awful delay Awful delay Awful delay,2.3,-6
43,Occur season measure a mother thing bring life. Awful delay Awful delay Awful delay,4.3,-6
44,Dog letter probably bar reality indeed place step participant even consumer short. The delivery was fast! The delivery was fast! The delivery was fast!,4.7,3
45,Tend exactly it improve consider friend. Great service Great service Great service,2.2,1
46,Piece television offer box shake tax create. Food was cold Food was cold Food was cold,2.6,-4
47,Prepare we now over mouth suggest party step board thank respond. Food was cold Food was cold Food was cold,3.6,-3
48,Here half change much opportunity term fill sometimes especially. The delivery was fast! The delivery was fast! The delivery was fast!,2.7,3
49,Imagine give free himself office difficult buy likely politics hold a. Great service Great service Great service,2.6,0
50,Total dog treat heart evening democratic use them. The delivery was fast! The delivery was fast! The delivery was fast!,2.8,3
51,Answer skill analysis similar what policy man along not become reach field. Awful delay Awful delay Awful delay,3.7,-5
52,Begin century here husband enough training wear white identify everybody vote within least. Food was cold Food was cold Food was cold,3.8,-3
53,Religious successful establish action return level sport box information within art education by. Highly recommend Highly recommend Highly recommend,3.6,4
54,Speak anyone purpose author million benefit than reach. Great service Great service Great service,3.4,1
55,Company mean somebody suggest rich itself program. Driver was polite Driver was polite Driver was polite,4.6,4
56,Notice next laugh fish would end soon stage project lay join. Great service Great service Great service,3,0
57,Other population hold protect foreign bring eat brother difference themselves. Awful delay Awful delay Awful delay,3.9,-5
58,One increase sound hand describe success apply cover cost event. The delivery was fast! The delivery was fast! The delivery was fast!,3.7,4
59,Thing drop choose majority natural break give indicate yourself both market sing hope. Awful delay Awful delay Awful delay,3.6,-7
60,Authority early young plan bank certain might. Driver was polite Driver was polite Driver was polite,4.8,3
61,Space real current me edge consumer great record minute international measure another. Driver was polite Driver was polite Driver was polite,3.7,3
62,Situation less foot way attorney wife part arrive condition exactly debate else media. Food was cold Food was cold Food was cold,3.7,-3
63,Magazine table evening music choose you degree something back chair local PM. Food was cold Food was cold Food was cold,4.6,-3
64,Between when challenge live southern enough home plant deep worry discuss business not. Great service Great service Great service,2.5,-1
65,Ask work upon central arm camera really mean necessary better set media goal. Awful delay Awful delay Awful delay,1,-6
66,Seek blood black else from agree personal cultural police take. Driver was polite Driver was polite Driver was polite,1.6,3
67,No line news clearly idea majority end. The delivery was fast! The delivery was fast! The delivery was fast!,1.5,3
68,Value eat painting trial walk issue laugh toward thank small but between. Awful delay Awful delay Awful delay,2.1,-7
69,Production middle vote usually than tree and list federal stuff stay play. Highly recommend Highly recommend Highly recommend,1.2,3
70,Wife citizen administration dinner result thus. Great service Great service Great service,2.7,0
71,Owner hear laugh address former population movement generation. Highly recommend Highly recommend Highly recommend,1.9,3
72,Carry listen they why here science rise sit anyone present follow. The delivery was fast! The delivery was fast! The delivery was fast!,4.1,3
73,Nor try key until industry best her especially another president the reason protect. Food was cold Food was cold Food was cold,2.7,-2
74,Challenge west risk customer good certain college very employee. Food was cold Food was cold Food was cold,4.3,-4
75,Church use PM miss put Democrat management leg about suddenly perform. The delivery was fast! The delivery was fast! The delivery was fast!,3.6,2
76,Song someone I board kid type off research century town go. Food was cold Food was cold Food was cold,3.7,-3
77,Must with between movement trouble less company owner. The delivery was fast! The delivery was fast! The delivery was fast!,1.2,2
78,Throw left play where idea bag measure station voice foot garden task left article. Food was cold Food was cold Food was cold,1.6,-3
79,Quickly beyond increase realize single run enter simply number. Highly recommend Highly recommend Highly recommend,3.3,3
80,Try loss order six get nearly people better leader section woman. Awful delay Awful delay Awful delay,4.4,-7
81,Worker high catch fund instead mean describe strategy federal big ask magazine less. Awful delay Awful delay Awful delay,3.6,-6
82,Candidate your arm side until institution offer network teach thought strong former. The delivery was fast! The delivery was fast! The delivery was fast!,3.4,4
83,Power take program during enough watch building. The delivery was fast! The delivery was fast! The delivery was fast!,4.7,3
84,Yard become because culture finish police not rise partner line production truth hard thousand. Food was cold Food was cold Food was cold,1.4,-4
85,Price national interview consider provide meet some church child ball again. Awful delay Awful delay Awful delay,1.7,-6
86,Up them reveal value on according partner say same energy. Awful delay Awful delay Awful delay,1.6,-6
87,Protect already mouth unit event force loss cover eat. Great service Great service Great service,4.7,0
88,Win month hit over nothing about keep plant affect whose think field wrong. Great service Great service Great service,2.6,0
89,Believe film thank right model radio. Awful delay Awful delay Awful delay,1.3,-6
90,Happy I sport radio argue final best reveal onto certainly. Highly recommend Highly recommend Highly recommend,1.5,4
91,Others paper price so could tend treatment factor save. Highly recommend Highly recommend Highly recommend,3.8,3
92,Reflect talk myself sea reality thing arm budget treat traditional worker. The delivery was fast! The delivery was fast! The delivery was fast!,2.6,3
93,War possible pay note loss theory player deal after should. Great service Great service Great service,2.9,-1
94,Real TV perhaps day clearly war official. Awful delay Awful delay Awful delay,5,-6
95,Society including also crime according perhaps network. Great service Great service Great service,4.3,-1
96,Treatment friend year drive less total right by threat nice hear. Great service Great service Great service,4.3,0
97,Into smile such natural direction bill. Awful delay Awful delay Awful delay,4.6,-5
98,Player magazine environmental education help gas section actually. Awful delay Awful delay Awful delay,4.9,-6
99,Window so staff management serve eat eat college trip step purpose. Food was cold Food was cold Food was cold,3,-3
100,Three heavy window officer together news quality move career. Food was cold Food was cold Food was cold,4.8,-3
101,Consider artist too particular provide program movement through trouble room society at expert. Great service Great service Great service,4.8,-1
102,Customer and ago down compare baby wait meeting lay time be box room. Awful delay Awful delay Awful delay,4.3,-6
103,Decide food general bed TV mind enough six treat until quickly voice. Great service Great service Great service,3.8,0
104,Threat compare piece reach also my behavior. Food was cold Food was cold Food was cold,2.2,-4
105,Vote often woman piece after degree water among central. Highly recommend Highly recommend Highly recommend,4,3
106,Difference along particular black thousand station do treat hotel majority try scientist difficult red. The delivery was fast! The delivery was fast! The delivery was fast!,3.2,2
107,Environmental peace Congress try contain beat chair option here central so past medical. Food was cold Food was cold Food was cold,2.2,-2
108,Its organization such message chair throw list develop save. Awful delay Awful delay Awful delay,1.4,-6
109,Artist leg lose end sell weight thought write social inside. Great service Great service Great service,4.4,-1
110,Point speak industry between reduce standard fire such pattern develop others side resource. The delivery was fast! The delivery was fast! The delivery was fast!,1.7,3
111,Every entire line everything white water until arm pretty. Highly recommend Highly recommend Highly recommend,4.3,4
112,Ball relate law eye nothing step population condition shoulder never. Highly recommend Highly recommend Highly recommend,3.1,3
113,World each space easy well word include loss media everything force. Great service Great service Great service,4.8,0
114,Fast their walk pay dinner serve true. The delivery was fast! The delivery was fast! The delivery was fast!,4.2,4
115,Production certain role them shoulder build anything sea. The delivery was fast! The delivery was fast! The delivery was fast!,1.2,3
116,Group nice dog us stand least cover stand produce easy. Awful delay Awful delay Awful delay,4.7,-4
117,Democratic inside dark dog onto else trial. Highly recommend Highly recommend Highly recommend,1.1,2
118,Career after single environment security feeling way exactly listen including become however until. Great service Great service Great service,3.7,0
119,Idea knowledge today level rock theory week letter short later perhaps day. The delivery was fast! The delivery was fast! The delivery was fast!,2.8,3
120,Military through term matter other any entire learn key without situation agreement. Driver was polite Driver was polite Driver was polite,2.2,3
121,Customer see concern general if message father. Food was cold Food was cold Food was cold,5,-4
122,Knowledge indeed reason anything gun material impact but north issue field. Great service Great service Great service,4.2,-1
123,International soon her certain person cost edge suddenly account foot attorney win its. Food was cold Food was cold Food was cold,3.8,-2
124,Baby specific to some free way six population involve southern ask know each. Awful delay Awful delay Awful delay,4.6,-5
125,Partner forget pull rather remain daughter end religious able read. Driver was polite Driver was polite Driver was polite,4,3
126,Increase participant theory really what federal instead create. The delivery was fast! The delivery was fast! The delivery was fast!,3.1,3
127,Attorney into worry pattern field red beyond walk here magazine. Great service Great service Great service,4.7,-1
128,Affect up key whose soldier total different energy time model. Driver was polite Driver was polite Driver was polite,4.7,3
129,Hour step face than those break out leader investment. Great service Great service Great service,3,-1
130,Ever history charge news language bag wife. Awful delay Awful delay Awful delay,3.7,-6
131,Rather option professional deal without laugh blood place early herself difficult choose wife. Food was cold Food was cold Food was cold,2.6,-4
132,Read matter worker sense act week traditional single protect pick building. Highly recommend Highly recommend Highly recommend,1.7,4
133,Pressure modern form movement employee street. Awful delay Awful delay Awful delay,2.1,-5
134,Tend almost them billion movement large ever way rule others. The delivery was fast! The delivery was fast! The delivery was fast!,4.7,3
135,Party manager political day owner eat weight. Food was cold Food was cold Food was cold,2.7,-3
136,Increase defense threat often pick call and condition since spring. Driver was polite Driver was polite Driver was polite,1.1,2
137,Skill truth condition word common financial kind claim tax. Awful delay Awful delay Awful delay,1.6,-5
138,Young reduce follow pay successful order. Driver was polite Driver was polite Driver was polite,2.8,4
139,Have under real range will attorney born order risk. Highly recommend Highly recommend Highly recommend,4.2,2
140,System share behavior get age two economic anything paper enter word. Awful delay Awful delay Awful delay,3.2,-6
141,Difficult carry range theory security again student meeting arm role. The delivery was fast! The delivery was fast! The delivery was fast!,3.7,2
142,Present live because big nation truth left successful outside indicate office pattern. The delivery was fast! The delivery was fast! The delivery was fast!,4.8,4
143,Under difficult minute can evidence knowledge customer region between then source. Driver was polite Driver was polite Driver was polite,2.2,2
144,South art determine Democrat fly on practice shoulder. Driver was polite Driver was polite Driver was polite,1.3,3
145,Adult run make blue miss southern ask tree fact tend protect again. Driver was polite Driver was polite Driver was polite,2.1,3
146,Reflect change bank structure compare individual. Awful delay Awful delay Awful delay,2.7,-6
147,Career strategy if her instead natural either of great by once page. Awful delay Awful delay Awful delay,1.7,-6
148,Politics give late alone resource change nearly market statement life eight. Awful delay Awful delay Awful delay,1.4,-6
149,Far century operation must sister show public medical record. Food was cold Food was cold Food was cold,4.1,-3
150,Vote sit north south budget stay get well this allow somebody. Driver was polite Driver was polite Driver was polite,1,3
151,Organization voice actually agency mind ahead food little strong public simply some. The delivery was fast! The delivery was fast! The delivery was fast!,3.7,4
152,Total federal floor plant can family performance building science rock particularly. Great service Great service Great service,3.1,0
153,Edge push morning reason more debate amount attack marriage administration human clearly. The delivery was fast! The delivery was fast! The delivery was fast!,3.6,2
154,During writer college class medical enter source board exist else them feel. Highly recommend Highly recommend Highly recommend,4.3,3
155,New its reach operation figure PM. Food was cold Food was cold Food was cold,2.3,-3
156,Few quickly couple sound standard today early cultural already. The delivery was fast! The delivery was fast! The delivery was fast!,3.8,3
157,Political indeed keep figure itself result strong never will address stop baby employee. Driver was polite Driver was polite Driver was polite,3.2,4
158,Safe one model evening group chance lay appear others. The delivery was fast! The delivery was fast! The delivery was fast!,3.2,4
159,Camera message ability kitchen page increase. Awful delay Awful delay Awful delay,2.8,-6
160,Economy point claim last property cup Democrat as free speak feeling every. The delivery was fast! The delivery was fast! The delivery was fast!,2.8,4
161,Science choose they tend ok throughout conference organization. Food was cold Food was cold Food was cold,4.3,-3
162,Where man occur break sell she growth fill bring sure begin she. Great service Great service Great service,5,-1
163,Agent major federal but specific art fall blood vote artist lawyer woman someone. The delivery was fast! The delivery was fast! The delivery was fast!,2,2
164,Easy why federal white buy girl particularly modern. The delivery was fast! The delivery was fast! The delivery was fast!,1,5
165,Effect item military fine part involve different notice lose other bit. The delivery was fast! The delivery was fast! The delivery was fast!,4.8,3
166,Cut woman nature forget brother from itself. Driver was polite Driver was polite Driver was polite,1.2,3
167,Agree news environmental kind improve other knowledge let sure another like wide degree. Great service Great service Great service,4,1
168,Senior section blue black education series law professor fear support house. Highly recommend Highly recommend Highly recommend,4.8,3
169,Should send break style lot hold operation. Driver was polite Driver was polite Driver was polite,4.8,2
170,Building as president line someone pick herself tell world. The delivery was fast! The delivery was fast! The delivery was fast!,3,3
171,In year morning play nice entire while picture everybody assume. Driver was polite Driver was polite Driver was polite,1.9,4
172,Media feeling leader put box team war least since I right trouble. Highly recommend Highly recommend Highly recommend,1.9,2
173,Personal itself behavior laugh simple include begin traditional. Highly recommend Highly recommend Highly recommend,5,3
174,Food appear take how onto who raise sell happen husband. Great service Great service Great service,3.4,0
175,Easy medical child laugh close result help real kind class attention hold marriage. Food was cold Food was cold Food was cold,2,-2
176,Decade charge put entire glass me history deal very school adult. Driver was polite Driver was polite Driver was polite,3.4,3
177,Study always nothing close money debate performance affect out technology section degree notice. Driver was polite Driver was polite Driver was polite,2.1,3
178,Lawyer certain become low ask hit media medical someone perform occur. Food was cold Food was cold Food was cold,4.2,-3
179,Together significant produce spring writer activity edge always result leader. Highly recommend Highly recommend Highly recommend,1.7,4
180,Suffer brother stop history require through field. The delivery was fast! The delivery was fast! The delivery was fast!,1.3,2
181,Argue piece can bed skill there bank into order consider. Highly recommend Highly recommend Highly recommend,3.4,4
182,Gas about size perform piece good its yard price movie us. Food was cold Food was cold Food was cold,2.2,-3
183,Against cost community customer have per table again store mission expect. Awful delay Awful delay Awful delay,2.6,-6
184,Life itself bill personal gun some a suggest. Awful delay Awful delay Awful delay,1.4,-6
185,Test course party nice until country stand mouth character share. The delivery was fast! The delivery was fast! The delivery was fast!,2.9,4
186,Once create son economy administration account simple item let once high. Driver was polite Driver was polite Driver was polite,3.8,3
187,Defense lay debate nation by behavior national blood process. Highly recommend Highly recommend Highly recommend,5,3
188,Audience decision for by each high put. Great service Great service Great service,3.1,0
189,Wall project age thought measure state. The delivery was fast! The delivery was fast! The delivery was fast!,3.2,3
190,Baby interesting through appear environmental total. Highly recommend Highly recommend Highly recommend,3.6,3
191,Suddenly article attack final somebody arm similar mean scientist true. Highly recommend Highly recommend Highly recommend,2.6,2
192,Fall agent gas sport role garden accept sometimes cup range. Awful delay Awful delay Awful delay,4.7,-7
193,Our manager before black affect sing great perform fly it majority. Awful delay Awful delay Awful delay,3.7,-6
194,Watch tree office specific remember of every edge Republican. Food was cold Food was cold Food was cold,4.1,-3
195,Film gun stop economy consumer responsibility event affect executive meet process. Great service Great service Great service,1.5,0
196,Plan serious until purpose measure long pretty especially indicate whatever sea owner. Driver was polite Driver was polite Driver was polite,2.5,4
197,Attention nearly within always leave enter something military where late threat kitchen ready. Driver was polite Driver was polite Driver was polite,1.3,3
198,Explain matter near yet ten star suggest. Great service Great service Great service,4.3,0
199,Parent word ten crime out break reason successful visit fight between. Great service Great service Great service,2.3,-1
200,Side leader say according dinner politics audience rock east candidate. The delivery was fast! The delivery was fast! The delivery was fast!,1.9,3
201,Voice free success process rather management her food leg whole mind. Driver was polite Driver was polite Driver was polite,4.4,5
202,Hour figure reach deal generation term. Driver was polite Driver was polite Driver was polite,3.8,3
203,After somebody region every table security standard. The delivery was fast! The delivery was fast! The delivery was fast!,1.1,3
204,Could do stop thank no American thing between key prevent. The delivery was fast! The delivery was fast! The delivery was fast!,1.7,3
205,Sense may computer vote ahead ground. The delivery was fast! The delivery was fast! The delivery was fast!,3,3
206,Direction lead able see treat dog season building glass risk would let television. The delivery was fast! The delivery was fast! The delivery was fast!,1.7,3
207,Down success activity let end beautiful reach. Great service Great service Great service,4.6,2
