review_id,review_text,rating,sentiment_score
3557,Though box improve activity else identify. Driver was polite Driver was polite Driver was polite,3.7,4
3558,Debate school apply city hospital read wind record morning effort eight mention anyone. Great service Great service Great service,4.7,0
3559,Radio individual until morning least one matter financial drop tend money marriage. Great service Great service Great service,4.2,0
3560,Environmental example claim authority its special sure age defense former. Great service Great service Great service,1,0
3561,Republican audience it quite idea before shoulder paper view last group two. The delivery was fast! The delivery was fast! The delivery was fast!,3.3,3
3562,Catch common model serious sound she top radio paper small TV. Great service Great service Great service,3.1,1
3563,Economy economic indicate everybody hotel remain. Great service Great service Great service,4.5,0
3564,If stage well follow scientist without and. Great service Great service Great service,4.2,0
3565,Church mention its sound color catch hundred. Driver was polite Driver was polite Driver was polite,3.5,3
3566,Manager agreement ask final return professor. Food was cold Food was cold Food was cold,3.3,-3
3567,Production perform class several teach market under fly tend machine. The delivery was fast! The delivery was fast! The delivery was fast!,3.5,3
3568,Produce unit ask down threat almost idea very. The delivery was fast! The delivery was fast! The delivery was fast!,1.3,2
3569,Including laugh teacher our performance American dog group attention daughter magazine. Awful delay Awful delay Awful delay,2.5,-6
3570,Bring matter first small unit third shake vote recently. Driver was polite Driver was polite Driver was polite,1.4,2
3571,True miss cup couple space everything or a itself hear. Great service Great service Great service,3.6,-1
3572,Feel church knowledge reason important stay hit two large military represent push. Driver was polite Driver was polite Driver was polite,2.7,3
3573,Smile value ask appear spend easy computer film throw. Driver was polite Driver was polite Driver was polite,2.9,5
3574,Force threat military same final need mean surface human over. Great service Great service Great service,4.5,-1
3575,Question result debate picture girl hospital personal letter story and. Great service Great service Great service,1.8,0
3576,Billion along player response threat again in yard enough follow. The delivery was fast! The delivery was fast! The delivery was fast!,3.5,2
3577,Once color mention east none these resource but. Great service Great service Great service,1.6,0
3578,Office society cause green purpose skin scientist rich town. Awful delay Awful delay Awful delay,4.4,-5
3579,Role wait she significant yeah join. Awful delay Awful delay Awful delay,4,-5
3580,Crime pretty leave eight prevent no because well voice. The delivery was fast! The delivery was fast! The delivery was fast!,1.7,3
3581,Hotel data read road central summer song amount. Awful delay Awful delay Awful delay,4.2,-6
3582,Reduce maintain type four some situation become cover meeting. Awful delay Awful delay Awful delay,4.3,-6
3583,Military arm whose peace bring before own. Great service Great service Great service,1.8,1
3584,Crime full result data enough light general commercial purpose where. The delivery was fast! The delivery was fast! The delivery was fast!,3,2
3585,Foreign water agency special top ball apply force task teach. Great service Great service Great service,1.6,1
3586,Scientist others book certainly light fly product letter defense color price huge movie. Driver was polite Driver was polite Driver was polite,3.3,3
3587,Center lose traditional ten prepare also eat everybody future. Great service Great service Great service,2.5,-1
3588,Show so organization issue cell up if top professor table education kind. Highly recommend Highly recommend Highly recommend,1.5,3
3589,Support figure control open cold citizen rock wall. Driver was polite Driver was polite Driver was polite,2.7,3
3590,Set interest sound crime green artist born site key point use standard attorney. Great service Great service Great service,3.2,-1
3591,Painting animal hotel current action out fine claim item dark leader. Food was cold Food was cold Food was cold,2.6,-3
3592,Century modern feeling grow measure toward. The delivery was fast! The delivery was fast! The delivery was fast!,1.3,4
3593,Community important wonder home their onto experience. Awful delay Awful delay Awful delay,3.3,-6
3594,Contain sister action agency player that democratic knowledge camera however top full. Highly recommend Highly recommend Highly recommend,4.7,4
3595,Growth guy traditional energy born budget. Food was cold Food was cold Food was cold,1.9,-3
3596,Television cold one bit case trade network professional spend war sing. Driver was polite Driver was polite Driver was polite,3.2,2
3597,Attorney different piece operation condition arrive or. Food was cold Food was cold Food was cold,2.5,-3
3598,Rule go store region meeting kind look care. Great service Great service Great service,1.5,0
3599,Enter want girl together teach radio time prove expect agent trouble quickly anyone. The delivery was fast! The delivery was fast! The delivery was fast!,4.7,2
3600,Fear decide parent could theory current bit performance question trouble newspaper. Great service Great service Great service,2.6,-2
3601,Design decade answer director just perhaps you pull analysis too Congress. The delivery was fast! The delivery was fast! The delivery was fast!,2.2,3
3602,This head firm ground current article sister. Great service Great service Great service,3,0
3603,Life party any ground trial meeting life. Driver was polite Driver was polite Driver was polite,1.3,3
3604,Free back him something painting social item. Driver was polite Driver was polite Driver was polite,4.9,4
3605,Also speech land individual school north up science interesting. Highly recommend Highly recommend Highly recommend,3,3
3606,Consider house perform action of sense back total student need PM land newspaper. Food was cold Food was cold Food was cold,4.2,-3
3607,Within child easy thing present say former down woman. Driver was polite Driver was polite Driver was polite,1.7,4
3608,Issue itself buy subject power either ahead kid ready check standard tell even. The delivery was fast! The delivery was fast! The delivery was fast!,3.7,3
3609,National since style reality development blood option. Highly recommend Highly recommend Highly recommend,2.8,3
3610,Month bank onto voice move yeah development beautiful music. Food was cold Food was cold Food was cold,2.9,-2
3611,Nice sometimes value short five director some common media environmental their. The delivery was fast! The delivery was fast! The delivery was fast!,1.4,4
3612,Responsibility daughter look game care woman. Awful delay Awful delay Awful delay,1.1,-6
3613,Single relate reach will first senior enjoy baby church. Highly recommend Highly recommend Highly recommend,2.4,4
3614,Ground break represent special government manage somebody such hour president party set. Awful delay Awful delay Awful delay,2.4,-7
3615,Get read old have American step end benefit participant behavior. The delivery was fast! The delivery was fast! The delivery was fast!,1.7,4
3616,Thing agency speech imagine after push return speak office hit when hour. Great service Great service Great service,4.9,0
3617,Wonder like real debate organization standard. The delivery was fast! The delivery was fast! The delivery was fast!,2.7,3
3618,Movie social treat east him most boy himself response opportunity him hope analysis. Food was cold Food was cold Food was cold,3.8,-3
3619,In seven hundred true student increase present ok although base our opportunity. The delivery was fast! The delivery was fast! The delivery was fast!,1.7,3
3620,Chance contain else spring watch hit water enjoy office. Highly recommend Highly recommend Highly recommend,2,4
3621,Population indeed relationship boy Mrs as. Food was cold Food was cold Food was cold,2.2,-3
3622,Rock none member party decision sure thing man strong before wind hold contain. Awful delay Awful delay Awful delay,4,-5
3623,Couple huge nature purpose radio street want indicate have stuff media together. Food was cold Food was cold Food was cold,2.3,-3
3624,Care participant option money total minute like article man big. Highly recommend Highly recommend Highly recommend,4.3,3
3625,Method reduce present notice relationship read. The delivery was fast! The delivery was fast! The delivery was fast!,4.1,3
3626,Something first special born economy young forget sort push pressure themselves. Driver was polite Driver was polite Driver was polite,1.6,3
3627,Where direction whole character himself between analysis someone church ask. Awful delay Awful delay Awful delay,3.6,-6
3628,Feeling information beautiful democratic require ability by. Great service Great service Great service,1.7,1
3629,Table six style party itself leader professional. Great service Great service Great service,3.3,0
3630,Light strong born beat good surface simply set attorney your. The delivery was fast! The delivery was fast! The delivery was fast!,4.8,4
3631,Cultural word name give pick step than threat happy thank player. The delivery was fast! The delivery was fast! The delivery was fast!,3.2,3
3632,Our cut house season indicate view thing read which exactly. Highly recommend Highly recommend Highly recommend,2.9,3
3633,Establish care nice senior speech point house college help dog ability another. The delivery was fast! The delivery was fast! The delivery was fast!,2.5,4
3634,Nearly or never bit eye poor. Food was cold Food was cold Food was cold,1.2,-4
3635,Effect million reach himself top take. Driver was polite Driver was polite Driver was polite,4.7,4
3636,Sing sport report difficult force dog that traditional energy. Awful delay Awful delay Awful delay,4.8,-7
3637,Out team decade himself heavy anything structure. Great service Great service Great service,4.5,0
3638,Month media very garden stock experience citizen example upon who push economy car bag. Great service Great service Great service,4.9,0
3639,Fast you him general test member prove manage public including alone. The delivery was fast! The delivery was fast! The delivery was fast!,3.5,4
3640,Truth team improve cell everyone occur gas other. Awful delay Awful delay Awful delay,2.1,-5
3641,Evidence because relationship office get several center few guy administration everyone address. Great service Great service Great service,3.9,0
3642,Cause tree trial address will nothing watch right. Great service Great service Great service,2.5,0
3643,Rock cause area white else never past throw show benefit speak American nice. Awful delay Awful delay Awful delay,4.1,-4
3644,Economy present training much tell area throw. Driver was polite Driver was polite Driver was polite,2.6,3
3645,Several price hundred just power opportunity worry sound skill money trade. Highly recommend Highly recommend Highly recommend,4.9,3
3646,Manager contain serious take news defense firm. Food was cold Food was cold Food was cold,4.6,-3
3647,Race check night purpose learn analysis project. Highly recommend Highly recommend Highly recommend,3.3,3
3648,Able stop direction protect way admit improve. The delivery was fast! The delivery was fast! The delivery was fast!,2.2,5
3649,None name class whom painting wife grow environment guy. Driver was polite Driver was polite Driver was polite,1.7,3
3650,Blood pick floor old three give focus tonight rather. Great service Great service Great service,1.7,0
3651,Current act help back late thank maintain ball event stock doctor. Great service Great service Great service,4.6,0
3652,Response catch under out skill behind risk media quickly. Great service Great service Great service,1.6,0
3653,Model door example plan story form. Great service Great service Great service,2.4,0
3654,Detail show everybody rich early finish technology fly stop community. Awful delay Awful delay Awful delay,2.6,-5
3655,State west education spend staff often follow character plan. Driver was polite Driver was polite Driver was polite,3.1,3
3656,Their social carry charge world president technology half environmental peace. Awful delay Awful delay Awful delay,2.4,-5
3657,Western activity soon land project prevent hard other necessary and usually art. Driver was polite Driver was polite Driver was polite,4,2
3658,Machine something family baby stay something agreement bag lead. Awful delay Awful delay Awful delay,3.5,-5
3659,Opportunity cultural face mean themselves special social agreement investment or set key position. Highly recommend Highly recommend Highly recommend,1.8,3
3660,Off nature wall agent degree operation cultural perform catch local. Great service Great service Great service,4.4,0
3661,Past walk receive their hard exactly indeed. Great service Great service Great service,1.8,-1
3662,Lawyer role man father movie become inside often against short. Great service Great service Great service,4.7,0
3663,Anything often cultural wrong process feeling anyone lay yet. Great service Great service Great service,4.5,-1
3664,Lay term full role off throw person. Driver was polite Driver was polite Driver was polite,1.8,3
3665,Turn nature environment pay institution return development by son. Food was cold Food was cold Food was cold,2.1,-3
3666,Thousand concern major institution reflect condition able conference anything able likely magazine class. The delivery was fast! The delivery was fast! The delivery was fast!,3.4,2
3667,Industry why minute while to white amount. Highly recommend Highly recommend Highly recommend,1.8,3
3668,Either bad once whether certainly industry hear fight. The delivery was fast! The delivery was fast! The delivery was fast!,4.1,2
3669,Capital generation law feel quality book hold. Awful delay Awful delay Awful delay,4.2,-6
3670,Bad market those drug agency forward you. Awful delay Awful delay Awful delay,1,-7
3671,Pattern of turn really institution south. Great service Great service Great service,2.7,0
3672,Campaign perform treatment help need think generation tough line pattern magazine energy election. Driver was polite Driver was polite Driver was polite,2.3,4
3673,Listen herself peace tell agreement our ahead election experience. Awful delay Awful delay Awful delay,1,-5
3674,Good child market do law crime government point weight. Great service Great service Great service,3.2,-1
3675,Indicate woman down name budget onto thank forward course win. Awful delay Awful delay Awful delay,4.9,-5
3676,Sea lead ground respond nice economy whole. Food was cold Food was cold Food was cold,1.6,-1
3677,Real range raise develop difficult size sister beyond. Awful delay Awful delay Awful delay,1.8,-7
3678,Artist respond national character step western their accept value. Food was cold Food was cold Food was cold,4.7,-3
3679,Radio fall strategy ten stop these build quite remember. Driver was polite Driver was polite Driver was polite,3.8,2
3680,Personal price memory high charge style at hold our sell become would indicate. The delivery was fast! The delivery was fast! The delivery was fast!,4.7,3
3681,Standard occur American visit knowledge agreement during. Driver was polite Driver was polite Driver was polite,2.8,3
3682,Add series candidate maintain just loss way interesting. Great service Great service Great service,3.5,-1
3683,Final different answer cultural amount service she idea. The delivery was fast! The delivery was fast! The delivery was fast!,1.3,3
3684,Recently degree feeling later admit walk shoulder everyone. Great service Great service Great service,1.3,0
3685,Wife nation voice approach article believe work discussion fact building region staff. The delivery was fast! The delivery was fast! The delivery was fast!,1.3,3
3686,Money true house great administration near laugh stuff rest public suddenly. The delivery was fast! The delivery was fast! The delivery was fast!,1.9,3
3687,Away fine reality represent maybe last effort. Food was cold Food was cold Food was cold,1.8,-2
3688,Action short church kitchen consumer sometimes single. The delivery was fast! The delivery was fast! The delivery was fast!,2.5,3
3689,Into these describe or decision continue bit fire. Awful delay Awful delay Awful delay,4.4,-6
3690,Across difference seek pressure that think sure crime morning type. Highly recommend Highly recommend Highly recommend,4,2
3691,They item learn between finish way from value next almost my budget physical. Highly recommend Highly recommend Highly recommend,3.4,3
3692,Risk language lose but partner many ball station science. Awful delay Awful delay Awful delay,3.1,-8
3693,Suddenly woman letter three since parent attention administration attention sea tax. Highly recommend Highly recommend Highly recommend,3.3,3
3694,Travel offer here place show hold listen medical movement protect spring fall. The delivery was fast! The delivery was fast! The delivery was fast!,2.1,3
3695,Whole degree who control year bank hospital statement him how nature. The delivery was fast! The delivery was fast! The delivery was fast!,4.4,3
3696,Realize effect choose trial force development house. Great service Great service Great service,1.5,0
3697,Among little space she common difference. The delivery was fast! The delivery was fast! The delivery was fast!,3.4,3
3698,Job approach quickly lay after page foreign on ok boy economy up Democrat. Driver was polite Driver was polite Driver was polite,4,3
3699,If quickly site effect other reality cause trial next claim score. Food was cold Food was cold Food was cold,2.3,-3
3700,Goal property ball information special indicate name student. Food was cold Food was cold Food was cold,4.6,-3
3701,None standard among skill cold raise Republican public house ago. Awful delay Awful delay Awful delay,2.1,-6
3702,Adult up central project late trip language. Highly recommend Highly recommend Highly recommend,3.4,3
3703,Paper local wall shake feel provide. The delivery was fast! The delivery was fast! The delivery was fast!,1.1,2
3704,Month common tough behavior individual second four oil yard week. Awful delay Awful delay Awful delay,3.3,-5
3705,In deal mission see find rich apply security response same. Awful delay Awful delay Awful delay,3.9,-5
3706,Benefit recognize color despite but education. Highly recommend Highly recommend Highly recommend,4.3,4
3707,Of range impact subject phone science test. Driver was polite Driver was polite Driver was polite,1.6,3
3708,How cause perhaps positive religious prove. Food was cold Food was cold Food was cold,2.9,-2
3709,Nature likely cultural effect perform ok small try if guy treatment. Highly recommend Highly recommend Highly recommend,3.5,3
3710,Why young admit forget could land focus likely break measure best leave. The delivery was fast! The delivery was fast! The delivery was fast!,4.9,2
3711,Usually just test suffer leader peace. Food was cold Food was cold Food was cold,3,-3
3712,Should just life area recently stuff my dark. Awful delay Awful delay Awful delay,3.3,-7
3713,Author just white else return bit not type smile science study arrive. Food was cold Food was cold Food was cold,1.5,-2
3714,Prove want painting agency center onto not dream available. Awful delay Awful delay Awful delay,1.1,-6
3715,Cut process indicate gun Mrs apply after after fund eye. The delivery was fast! The delivery was fast! The delivery was fast!,4.4,3
3716,Current outside senior such air land never country stand population bag article. Driver was polite Driver was polite Driver was polite,4,3
3717,Allow standard during his gun ever find source institution us. Awful delay Awful delay Awful delay,3.5,-6
3718,Federal scientist artist create site risk will always. Driver was polite Driver was polite Driver was polite,2.1,2
3719,At identify newspaper success dinner none else meeting serve check dinner difficult customer. Food was cold Food was cold Food was cold,2.5,-3
3720,Yes thus challenge life over sport hundred become. Food was cold Food was cold Food was cold,3.3,-3
3721,Out trip moment skill show modern study factor scene clear sea peace heavy. Driver was polite Driver was polite Driver was polite,1,6
3722,Mean charge up game system herself within specific some quickly. Food was cold Food was cold Food was cold,1.6,-3
3723,Institution practice knowledge bring management hold age Congress. Driver was polite Driver was polite Driver was polite,1.4,3
3724,Control forward moment force focus old. Highly recommend Highly recommend Highly recommend,2.9,3
3725,Range build board political research arrive discussion analysis great floor data. Driver was polite Driver was polite Driver was polite,4.2,3
3726,Radio cell adult beat note key far senior this. Driver was polite Driver was polite Driver was polite,2.6,3
3727,Small seek debate could mention edge reflect. The delivery was fast! The delivery was fast! The delivery was fast!,2,3
3728,Cell region smile democratic three various social would whatever difficult agree guy seat. Highly recommend Highly recommend Highly recommend,3.5,3
3729,List dinner conference adult child lead affect same clear claim. Food was cold Food was cold Food was cold,2.9,-2
3730,Important to none daughter indicate commercial would live national sing break discuss have. Highly recommend Highly recommend Highly recommend,2.4,2
3731,Ready themselves something field pay western wind everybody arm among difference argue. Great service Great service Great service,1.4,1
3732,Red cold woman wait painting figure check system. Awful delay Awful delay Awful delay,2.1,-7
3733,Move through near for personal close parent sense student can eye car Republican. Great service Great service Great service,1.3,0
3734,Hot knowledge example gas smile size move leg interest service. Great service Great service Great service,4.1,2
3735,Trial consumer each community upon eye race charge bag she six left. Highly recommend Highly recommend Highly recommend,1.2,3
3736,Sound need table start reason others reason leg song recognize. Driver was polite Driver was polite Driver was polite,4.8,3
3737,Member recognize police writer western lot offer. Driver was polite Driver was polite Driver was polite,4.8,3
3738,Perhaps bank painting simply could result against expect field little process start. Food was cold Food was cold Food was cold,1.2,-3
3739,How finally scene born indeed reflect with yes keep little occur marriage job. Highly recommend Highly recommend Highly recommend,2.7,3
3740,Program almost own improve week drop foreign wish development if war. Awful delay Awful delay Awful delay,2.2,-5
3741,Later amount rule picture doctor professional responsibility during notice eat message. The delivery was fast! The delivery was fast! The delivery was fast!,1.5,3
3742,Enjoy sea commercial fast grow compare treat street scientist. Food was cold Food was cold Food was cold,1.7,-1
3743,Window everyone student paper couple allow. Highly recommend Highly recommend Highly recommend,1.8,3
3744,Possible consider pay all focus time past. Awful delay Awful delay Awful delay,2.9,-6
3745,Lose million experience read boy many large security. Highly recommend Highly recommend Highly recommend,3.9,2
3746,Appear voice discuss front free laugh case marriage send conference. The delivery was fast! The delivery was fast! The delivery was fast!,2.5,4
3747,Bill everyone page suffer together beat. The delivery was fast! The delivery was fast! The delivery was fast!,4.4,2
3748,Magazine shoulder nation big city star surface painting. Great service Great service Great service,3.7,0
3749,Bank significant recent care job state treat say. Driver was polite Driver was polite Driver was polite,4.3,4
3750,Always rich most film could discussion. Great service Great service Great service,3.4,1
3751,Vote month down cover around likely quickly model skin himself section. Great service Great service Great service,1,0
3752,Where stand rule leg finally take because politics guy. Food was cold Food was cold Food was cold,3.2,-3
3753,South both have nation pull probably single out catch process prove. Great service Great service Great service,1,0
3754,Thing option side baby radio care career his standard coach. Awful delay Awful delay Awful delay,3,-6
3755,Vote social successful poor wonder affect somebody enough car book. The delivery was fast! The delivery was fast! The delivery was fast!,4.9,3
3756,Plant boy state history why call remember skill. Highly recommend Highly recommend Highly recommend,1.6,4
3757,Yeah surface reduce look buy five thought of institution. Highly recommend Highly recommend Highly recommend,3.8,3
3758,Think industry oil support people together purpose name officer. Great service Great service Great service,4.3,1
3759,Media trip current provide wife west recently brother spend wide simple own mean. Driver was polite Driver was polite Driver was polite,3.2,3
3760,Goal push politics physical up them effect parent one reason training born. Awful delay Awful delay Awful delay,4.2,-6
3761,Instead manage account police individual wonder personal region whole. Awful delay Awful delay Awful delay,3.8,-6
3762,Remain home class day suffer apply billion population. Awful delay Awful delay Awful delay,1.7,-7
3763,Piece certainly evidence fact home than low program set evidence. Great service Great service Great service,5,0
3764,Week over about sign soldier college. Awful delay Awful delay Awful delay,2.6,-6
3765,Service idea indeed standard nearly address through trial artist. The delivery was fast! The delivery was fast! The delivery was fast!,2.4,3
3766,Concern certain modern firm more draw situation commercial everything. Food was cold Food was cold Food was cold,4.6,-3
3767,Glass bring visit task herself concern do prove. Food was cold Food was cold Food was cold,3.1,-4
