review_id,review_text,rating,sentiment_score
1258,Statement remember hard house third bar clearly create decision thus better. Driver was polite Driver was polite Driver was polite,1.5,2
1259,Individual decide leg section poor score third item attention yeah three stock camera. Awful delay Awful delay Awful delay,1.4,-7
1260,Resource economy candidate provide big long behind hold again account past turn. Driver was polite Driver was polite Driver was polite,1.4,3
1261,At hit year old relate watch. Driver was polite Driver was polite Driver was polite,3.1,3
1262,Else pick quickly fight real husband smile spring speak government director leave. The delivery was fast! The delivery was fast! The delivery was fast!,1.5,4
1263,Woman government increase perform standard sure. Awful delay Awful delay Awful delay,4.5,-6
1264,Organization back according successful carry marriage fill individual the interest rich. Food was cold Food was cold Food was cold,5,-1
1265,Business everybody industry need standard his send measure he indicate someone. Great service Great service Great service,2.2,0
1266,Son help green along doctor seven candidate husband everyone. Driver was polite Driver was polite Driver was polite,1.1,3
1267,Trade capital major civil head other cell during mind teach. Food was cold Food was cold Food was cold,2.3,-3
1268,Two movement cell language true table worry a exactly view dog between series. Highly recommend Highly recommend Highly recommend,2.3,2
1269,Seat stop fill candidate product movie professor behind type east recently call blue. Awful delay Awful delay Awful delay,3.3,-6
1270,Similar positive age generation manage hospital arm term apply rich share despite. Great service Great service Great service,1.4,2
1271,Common above each debate others area whether beat under draw or figure candidate. Food was cold Food was cold Food was cold,2.3,-3
1272,Up world prepare expect close the wall create agree alone walk cause. The delivery was fast! The delivery was fast! The delivery was fast!,4.5,3
1273,From cell much age gas leader interview amount lead. The delivery was fast! The delivery was fast! The delivery was fast!,3.3,4
1274,Usually activity friend hotel seek list family outside morning. Food was cold Food was cold Food was cold,5,-3
1275,Mrs industry reduce loss style citizen memory. Awful delay Awful delay Awful delay,4.5,-7
1276,Notice final computer seven lead its gun single leave a. Great service Great service Great service,4.7,1
1277,Turn wife brother field brother good. Great service Great service Great service,4.7,0
1278,Product cost reveal chance own media scene offer land nation significant face. Food was cold Food was cold Food was cold,2,-2
1279,Growth money own organization little relate environment. Awful delay Awful delay Awful delay,4.6,-6
1280,Certain meet future performance something against of. Driver was polite Driver was polite Driver was polite,3.1,3
1281,Political spend its carry human others age reason name arrive floor market through. Food was cold Food was cold Food was cold,4.2,-3
1282,No according cup economy social population cover. Highly recommend Highly recommend Highly recommend,4.4,3
1283,Management fear theory product citizen better point. Great service Great service Great service,1.6,-1
1284,Play line city watch art health fish fish full available that. Driver was polite Driver was polite Driver was polite,2.6,3
1285,Its wind these often identify whose some southern pick eye gun someone beat. Great service Great service Great service,4,0
1286,Others over rise recent contain field. Driver was polite Driver was polite Driver was polite,2.5,3
1287,Art into beat nature baby may strong set less whose. Great service Great service Great service,2.4,1
1288,Unit soldier board well woman affect town party next college camera black. Highly recommend Highly recommend Highly recommend,3.7,3
1289,Public data development well center year mother court writer any statement dark loss. Food was cold Food was cold Food was cold,4.9,-5
1290,Beyond expert throughout state likely raise old away arrive agency event born one. Awful delay Awful delay Awful delay,2.2,-6
1291,Data those involve last interview general including. Food was cold Food was cold Food was cold,1.5,-3
1292,New turn sit loss travel look affect can hope describe herself difference. Awful delay Awful delay Awful delay,3.6,-7
1293,Rather boy player gun check sport no step. Driver was polite Driver was polite Driver was polite,1.1,3
1294,Fish discussion wide want avoid know huge offer soldier garden political you. Driver was polite Driver was polite Driver was polite,1.3,3
1295,With agree arm feeling wrong benefit eat history wrong debate put might eye. Great service Great service Great service,3.1,-1
1296,Sometimes doctor if even decade rule deal art paper drop themselves. Driver was polite Driver was polite Driver was polite,4.4,3
1297,Nature into picture travel recently church student. Great service Great service Great service,4.8,0
1298,Right main suggest partner drive interesting win event. The delivery was fast! The delivery was fast! The delivery was fast!,2.5,4
1299,Response pattern knowledge see decide executive some use apply. Food was cold Food was cold Food was cold,3,-3
1300,Law medical production clear product sometimes. Highly recommend Highly recommend Highly recommend,4.5,3
1301,Put business style loss bag off these issue treat. Awful delay Awful delay Awful delay,3.7,-8
1302,Continue card child hit add miss heavy around expert order. Driver was polite Driver was polite Driver was polite,2.8,2
1303,Trip decision point perform sea respond short exist. Highly recommend Highly recommend Highly recommend,2.6,3
1304,Production many under around beat party nearly commercial gas beautiful campaign show. The delivery was fast! The delivery was fast! The delivery was fast!,1.5,4
1305,Guess drive scene dream side agreement adult get upon TV. The delivery was fast! The delivery was fast! The delivery was fast!,4.1,3
1306,Pm ball mind that work try effort identify. Highly recommend Highly recommend Highly recommend,1.1,3
1307,Office real give important force yes attention moment young magazine operation partner anyone. The delivery was fast! The delivery was fast! The delivery was fast!,4.9,3
1308,Trade fire health research public break security remain minute business mean discover hotel. The delivery was fast! The delivery was fast! The delivery was fast!,1.2,2
1309,Since yeah ten long do like lot free. Highly recommend Highly recommend Highly recommend,3.9,4
1310,Six say day treat then significant federal officer suddenly work. Highly recommend Highly recommend Highly recommend,4.4,4
1311,Wait him tree less life level baby go section western. Driver was polite Driver was polite Driver was polite,1.7,3
1312,South seat media drop beyond area especially. Great service Great service Great service,3.8,0
1313,Audience success clearly near it sell scientist style study machine. The delivery was fast! The delivery was fast! The delivery was fast!,3.1,4
1314,Lose do national away look relate out add half. Awful delay Awful delay Awful delay,3.2,-7
1315,Occur certainly she season movement save walk great nearly. The delivery was fast! The delivery was fast! The delivery was fast!,3.7,3
1316,Choice create government worker there charge approach third hard. Food was cold Food was cold Food was cold,4.9,-4
1317,Ever six affect phone reason particular we each usually month show. Great service Great service Great service,3.2,0
1318,Baby plant road grow cold around southern easy by president as different. Highly recommend Highly recommend Highly recommend,1.7,3
1319,Town wind challenge buy focus return since performance morning while choose. Great service Great service Great service,4.4,0
1320,Individual police really by hair seek affect skin. Highly recommend Highly recommend Highly recommend,3.5,3
1321,Will matter yes road him pretty moment speech dog position thought few contain. The delivery was fast! The delivery was fast! The delivery was fast!,4.5,4
1322,Country agree first president voice song standard next. Great service Great service Great service,1.9,0
1323,Long billion east method any production instead. Driver was polite Driver was polite Driver was polite,2,3
1324,If trade reality major tough establish sing arm military guy. Awful delay Awful delay Awful delay,4.4,-5
1325,House growth store represent item hand great brother. Awful delay Awful delay Awful delay,2.3,-6
1326,Want close night ground example road seem grow determine skill society. Highly recommend Highly recommend Highly recommend,2.4,4
1327,Shoulder day chance describe purpose skill including stock respond. Awful delay Awful delay Awful delay,2,-5
1328,Budget vote security yet record establish easy catch stuff power financial Mrs. Food was cold Food was cold Food was cold,4.7,-2
1329,Continue central community TV color answer political your next reason guy. Great service Great service Great service,4.8,0
1330,Anything identify particularly Congress fire think morning improve rock. Driver was polite Driver was polite Driver was polite,4.7,4
1331,Eight hit support energy happen card rather work professional throughout. Awful delay Awful delay Awful delay,3.6,-5
1332,Others second plant election decade quickly probably scene relate manage and evening person or. Driver was polite Driver was polite Driver was polite,1.9,3
1333,Local never idea likely class stage coach style report skin. Driver was polite Driver was polite Driver was polite,3.7,3
1334,Matter floor develop parent herself add conference. Awful delay Awful delay Awful delay,4.7,-6
1335,South fine measure meeting wife player ground protect high kind five shake hard. Great service Great service Great service,2.8,0
1336,City rather per Congress provide senior relationship part art drug firm fear. Highly recommend Highly recommend Highly recommend,2.2,2
1337,Type set step improve run every light ten at decide important. Great service Great service Great service,4.6,1
1338,Find everybody produce responsibility civil month always. Driver was polite Driver was polite Driver was polite,3.6,3
1339,Fine hand matter store perhaps later draw business understand fine live difficult. Food was cold Food was cold Food was cold,1.3,-2
1340,Social after former middle woman special price while life sell job suddenly. Food was cold Food was cold Food was cold,1.9,-3
1341,Fight use college everything explain reach six. Awful delay Awful delay Awful delay,3.4,-6
1342,Why window top head nor reduce PM affect season every speech wife. Awful delay Awful delay Awful delay,4.2,-5
1343,Us note cold moment behavior high use it become for age center. The delivery was fast! The delivery was fast! The delivery was fast!,3.2,2
1344,Arm stop environment unit weight impact apply of authority. The delivery was fast! The delivery was fast! The delivery was fast!,2.5,3
1345,Service very gun explain year law put else administration. Driver was polite Driver was polite Driver was polite,2.9,3
1346,Suffer each total far list none affect suggest attorney professional theory economic. Awful delay Awful delay Awful delay,4.6,-7
1347,Admit interest police them population science themselves marriage yes wife particular another. Food was cold Food was cold Food was cold,3.4,-3
1348,Network few voice term cultural enjoy nature. Highly recommend Highly recommend Highly recommend,2.8,4
1349,Western speech watch discover build since no. Food was cold Food was cold Food was cold,1.7,-3
1350,Use clear act article law appear her special. Great service Great service Great service,3.3,0
1351,Development thousand into skill certainly minute color. Food was cold Food was cold Food was cold,2.5,-2
1352,Produce national three issue environmental executive write behind without point rich customer newspaper. Food was cold Food was cold Food was cold,2.9,-3
1353,Ready green tough food important picture bit dog social worry. Food was cold Food was cold Food was cold,1.9,-2
1354,End medical east everybody instead author industry difficult require letter now difference. Awful delay Awful delay Awful delay,2.8,-7
1355,Course government concern let candidate compare certain. Driver was polite Driver was polite Driver was polite,4.6,2
1356,Build little goal parent phone suffer half. The delivery was fast! The delivery was fast! The delivery was fast!,2.9,2
1357,Analysis day we woman real evidence feel suggest class from participant. Great service Great service Great service,3.6,0
1358,House fear fish become radio financial force mother cause me. The delivery was fast! The delivery was fast! The delivery was fast!,1.7,2
1359,Population anyone interesting player clear oil student them again. Great service Great service Great service,2.7,0
1360,Entire culture account then network adult worry energy should star why family down. Driver was polite Driver was polite Driver was polite,4,2
1361,Stage suggest table natural defense institution growth executive could meet home. The delivery was fast! The delivery was fast! The delivery was fast!,2.5,3
1362,Development want stock represent never degree charge will gun its. Great service Great service Great service,3.3,0
1363,Skin sing move add care want beautiful whole fast serve south standard. Food was cold Food was cold Food was cold,1.4,-1
1364,Human would occur including indicate campaign. Great service Great service Great service,4.8,0
1365,Final point ago sure believe easy run. The delivery was fast! The delivery was fast! The delivery was fast!,1.8,4
1366,Family measure laugh road group she because somebody them wear thought. Driver was polite Driver was polite Driver was polite,3.3,3
1367,Stay compare the a despite term. Great service Great service Great service,3.3,0
1368,Choose decade force assume relate really trial about. Awful delay Awful delay Awful delay,1.3,-6
1369,Then evidence Democrat public on rest generation. Highly recommend Highly recommend Highly recommend,4,3
1370,Wait none fact church thus others kitchen full. Food was cold Food was cold Food was cold,1.5,-3
1371,Much local question suggest happen already worry nice medical moment. Awful delay Awful delay Awful delay,4.8,-6
1372,Yard age couple officer college detail inside. Food was cold Food was cold Food was cold,2.9,-3
1373,Appear about why weight new him else doctor husband. The delivery was fast! The delivery was fast! The delivery was fast!,2.2,3
1374,Would change say yourself myself seek along good. Driver was polite Driver was polite Driver was polite,1.2,3
1375,Thing experience then political raise live high list TV. The delivery was fast! The delivery was fast! The delivery was fast!,4,3
1376,Do responsibility quality writer event order relationship beautiful. The delivery was fast! The delivery was fast! The delivery was fast!,2.2,4
1377,Realize level large parent off general treat official strategy. Awful delay Awful delay Awful delay,4.5,-6
1378,Number huge us increase look lay. Food was cold Food was cold Food was cold,3,-3
1379,Discussion alone Mr pass much senior time space. Driver was polite Driver was polite Driver was polite,3.2,3
1380,Argue stay structure else weight less red. Great service Great service Great service,4.1,0
1381,Top every address less force their film drop stock hour. Great service Great service Great service,3.2,1
1382,Put candidate local dark I box third get get second rock. Food was cold Food was cold Food was cold,5,-4
1383,Whose somebody yet lose five her paper usually find activity rich doctor. Food was cold Food was cold Food was cold,1.4,-3
1384,Information total price save work remember score floor skin president program everything movie. The delivery was fast! The delivery was fast! The delivery was fast!,2,3
1385,Name increase base serve hear product success officer. Great service Great service Great service,4.7,1
1386,Perhaps suggest someone hit on career officer history. The delivery was fast! The delivery was fast! The delivery was fast!,2.8,3
1387,Dream energy detail candidate none will soon son owner whose many enough finally. Great service Great service Great service,1.4,0
1388,Now note style although significant example environmental election than statement research among big. Driver was polite Driver was polite Driver was polite,2.9,4
1389,You deep together race risk single newspaper kitchen. Great service Great service Great service,1.8,-1
1390,Describe well effect present plant professor traditional to continue growth. Great service Great service Great service,3.9,0
1391,Enter wrong relate lawyer magazine hard management. The delivery was fast! The delivery was fast! The delivery was fast!,3.8,1
1392,Who start another seem skill ever reveal. Great service Great service Great service,3.5,1
1393,Resource your hot happen employee not seat cut weight level here vote. The delivery was fast! The delivery was fast! The delivery was fast!,2,4
1394,Be ago across beat exactly anyone consider development. Food was cold Food was cold Food was cold,2.5,-3
1395,Bank industry friend argue president owner one since. Highly recommend Highly recommend Highly recommend,3,3
1396,Like such ability store claim including piece various expert however since than population set. Driver was polite Driver was polite Driver was polite,4.9,3
1397,From game player special million lead direction decision be. Awful delay Awful delay Awful delay,2.7,-5
1398,Let song although current not thought management trial whose generation civil minute during often. The delivery was fast! The delivery was fast! The delivery was fast!,4.8,3
1399,Reason hot rest simply because who. The delivery was fast! The delivery was fast! The delivery was fast!,3.4,4
1400,Couple anything money seem simple describe partner entire fish fall. Great service Great service Great service,2.4,-1
1401,Raise he indicate create report hotel arm service thus power her. Great service Great service Great service,3.3,0
1402,Room prepare during without way compare suddenly that always. The delivery was fast! The delivery was fast! The delivery was fast!,3.6,3
1403,Safe yet throughout team green resource economy couple. Highly recommend Highly recommend Highly recommend,2,4
1404,Good imagine would practice any beyond show never since thank visit two continue. The delivery was fast! The delivery was fast! The delivery was fast!,1.7,3
1405,Letter lose door grow baby amount she clear at just successful billion. Awful delay Awful delay Awful delay,5,-6
1406,Main crime after accept time college whose. Awful delay Awful delay Awful delay,4.2,-7
1407,Left plant wall best church those interview by lawyer majority. Food was cold Food was cold Food was cold,2.5,-3
1408,Above control total most include approach today and. Driver was polite Driver was polite Driver was polite,2.4,3
1409,Space politics region parent under if thank. Great service Great service Great service,3.8,0
1410,Media information be second buy address south project meet. The delivery was fast! The delivery was fast! The delivery was fast!,3,3
1411,Finally thousand put resource goal or do store near give perform help. Awful delay Awful delay Awful delay,3.3,-6
1412,Road according prove debate form paper country green ago her half take white. Food was cold Food was cold Food was cold,1.4,-3
1413,Time collection end stuff exactly technology worker person million free example thousand decision. The delivery was fast! The delivery was fast! The delivery was fast!,3.7,4
1414,Detail already soon develop bed investment institution maybe list network. Food was cold Food was cold Food was cold,2.2,-3
1415,Land college fine include officer sound according some. Food was cold Food was cold Food was cold,4,-2
1416,Issue person level specific station source visit. Great service Great service Great service,2.1,-1
1417,Never cultural employee week offer wish prepare difficult wear produce challenge. Food was cold Food was cold Food was cold,4.9,-4
1418,Vote pattern leave box man treat including politics. Driver was polite Driver was polite Driver was polite,2.7,3
1419,Movie hospital stop individual member treat common. Food was cold Food was cold Food was cold,3.1,-3
1420,Training stock physical almost phone energy follow role option management. Driver was polite Driver was polite Driver was polite,3.3,3
1421,Him probably seem manage sound this hold heart if ever economic industry. Food was cold Food was cold Food was cold,4.1,-3
1422,Imagine performance respond capital here while dark interesting garden plant wall. Highly recommend Highly recommend Highly recommend,2.7,2
1423,Fear house natural budget heart law course office. Food was cold Food was cold Food was cold,3.1,-4
1424,Window art attack marriage stand money. Awful delay Awful delay Awful delay,4.2,-7
1425,Interesting happy sure kid any light receive statement off subject school camera different. Driver was polite Driver was polite Driver was polite,2.1,4
1426,Result over film attack player news coach watch. Driver was polite Driver was polite Driver was polite,2.1,2
1427,Address popular animal space yourself head card arrive western. Awful delay Awful delay Awful delay,1.6,-5
1428,Star hospital value past deal full understand policy all look there. Awful delay Awful delay Awful delay,2.3,-6
1429,They nothing hit else special now behind owner sort mean production. Driver was polite Driver was polite Driver was polite,1.8,3
1430,Guess effect describe wait wind place eye. The delivery was fast! The delivery was fast! The delivery was fast!,3.5,3
1431,Develop full few child how above professor their memory garden save. Great service Great service Great service,4.7,0
1432,Home member at tough visit themselves realize someone father stage. Highly recommend Highly recommend Highly recommend,3.4,4
1433,Inside play station camera reach million expert note. Food was cold Food was cold Food was cold,4.4,-3
1434,Ask glass yet investment much might understand between rise inside age. Driver was polite Driver was polite Driver was polite,4.1,3
1435,Should popular reality medical religious minute themselves order responsibility investment probably spend know. Driver was polite Driver was polite Driver was polite,2.4,4
1436,I major industry data win treat gas care other create yourself. Food was cold Food was cold Food was cold,3.4,-2
1437,Goal occur according investment possible already which couple age. Awful delay Awful delay Awful delay,3.8,-6
1438,Say personal gun natural play ago nor. Awful delay Awful delay Awful delay,2.4,-6
1439,Who its girl bill strategy close less my. Great service Great service Great service,2.7,0
1440,School own media treatment ground as nice road increase south day. Food was cold Food was cold Food was cold,1.2,-2
1441,Soon concern condition never natural accept. Driver was polite Driver was polite Driver was polite,4.8,2
1442,Occur class others if defense budget check most. Great service Great service Great service,3.8,0
1443,Leave all attention room him wrong economy house particularly quality number. The delivery was fast! The delivery was fast! The delivery was fast!,1.5,2
1444,Human meeting ok trouble data his some performance goal. Great service Great service Great service,2.5,-1
1445,Nature president conference event when cover marriage learn region enjoy avoid account box life. Great service Great service Great service,2.1,1
1446,Yet us health gun hear look until ask sell. The delivery was fast! The delivery was fast! The delivery was fast!,4.7,3
1447,The which on own letter civil. Food was cold Food was cold Food was cold,3.7,-3
1448,Play enter from her kitchen throughout particular during certain sound. The delivery was fast! The delivery was fast! The delivery was fast!,3.8,3
1449,Clearly cover time effort time effect. Food was cold Food was cold Food was cold,1,-3
1450,Offer spring weight focus think somebody listen year religious up. Great service Great service Great service,2.2,0
1451,Similar list can return job left store week way return herself painting. The delivery was fast! The delivery was fast! The delivery was fast!,2.8,3
1452,Generation detail her practice difference keep people experience. Awful delay Awful delay Awful delay,4.7,-6
1453,Draw expect final list its sell. The delivery was fast! The delivery was fast! The delivery was fast!,1.7,3
1454,Unit age action shake under want city blue figure look most eight. Great service Great service Great service,3,-1
1455,Total per discover despite out figure treat really data head herself table. Awful delay Awful delay Awful delay,3.6,-6
1456,Such threat picture general school begin modern condition. Awful delay Awful delay Awful delay,2.5,-6
1457,Boy small something production modern wife present. Great service Great service Great service,1.4,1
1458,Guy business special food approach play. Driver was polite Driver was polite Driver was polite,1.5,3
1459,Pressure surface glass PM fear upon young reason available culture put. The delivery was fast! The delivery was fast! The delivery was fast!,3.4,2
1460,Force while full dinner analysis beyond energy finally have talk. Highly recommend Highly recommend Highly recommend,4.9,3
1461,Name clear national grow citizen down. The delivery was fast! The delivery was fast! The delivery was fast!,3.3,3
1462,By left appear audience lose employee forget vote one this piece must possible. Food was cold Food was cold Food was cold,2.9,-4
1463,Ahead film interview pick put PM fact remain writer hot build appear account. Highly recommend Highly recommend Highly recommend,4.8,4
1464,Help option reduce doctor write language expert cell artist edge. Food was cold Food was cold Food was cold,2,-3
1465,Generation indicate main born who require indicate analysis sure relationship difference just. Awful delay Awful delay Awful delay,1.7,-6
