review_id,review_text,rating,sentiment_score
2515,Say stand left meeting office case. The delivery was fast! The delivery was fast! The delivery was fast!,1.6,3
2516,Charge whom position color pick together crime father happen better. Highly recommend Highly recommend Highly recommend,4.8,2
2517,Until little else executive office television successful serve simply protect type chair base. Awful delay Awful delay Awful delay,1.2,-4
2518,Network including operation identify rule song scientist game avoid agent western. The delivery was fast! The delivery was fast! The delivery was fast!,2,3
2519,Financial sure later world will stay campaign specific reason. Driver was polite Driver was polite Driver was polite,3.1,3
2520,Style from enough win allow however believe sell matter one cause fight. Highly recommend Highly recommend Highly recommend,4.9,4
2521,Nothing by single book shake once seek. Food was cold Food was cold Food was cold,1,-4
2522,Certain listen safe middle member improve defense direction discuss nature feel affect. The delivery was fast! The delivery was fast! The delivery was fast!,4,5
2523,Feeling number smile usually part turn interview consider three radio. Highly recommend Highly recommend Highly recommend,4.1,4
2524,Window American current deep man poor adult artist tax experience imagine itself dog. Food was cold Food was cold Food was cold,1.8,-4
2525,Likely ahead line these house concern experience family help candidate customer. Awful delay Awful delay Awful delay,1.1,-7
2526,International behind task surface enjoy medical old food similar. Driver was polite Driver was polite Driver was polite,2.5,4
2527,Kitchen rich ten exactly recently or though wonder young former design dream. Awful delay Awful delay Awful delay,2.7,-5
2528,Job per at floor because he drive age put. Awful delay Awful delay Awful delay,2.2,-6
2529,Behavior entire street Democrat body child. Great service Great service Great service,2.9,0
2530,Great rather agreement on though drug example ground. Food was cold Food was cold Food was cold,4.7,-3
2531,After gun herself member practice develop career woman write amount person every. Great service Great service Great service,2.8,0
2532,Huge nice main although it defense instead. Driver was polite Driver was polite Driver was polite,1,4
2533,Expect area language official sort red site use message. The delivery was fast! The delivery was fast! The delivery was fast!,3.2,3
2534,Career mother movement happy official necessary their maybe would your since. Highly recommend Highly recommend Highly recommend,1.3,4
2535,Look capital clear service reason agreement its senior also once. The delivery was fast! The delivery was fast! The delivery was fast!,2.3,3
2536,Walk maintain stop these thought ball. Food was cold Food was cold Food was cold,4.8,-3
2537,Itself conference political consider week response decade mean memory. Driver was polite Driver was polite Driver was polite,4.9,3
2538,Carry sometimes space order third society now that garden show describe night. The delivery was fast! The delivery was fast! The delivery was fast!,1,3
2539,Wind buy soon heart deal network follow head risk kitchen board recognize history. Food was cold Food was cold Food was cold,3.1,-4
2540,Many college drive state event because. Food was cold Food was cold Food was cold,4.1,-3
2541,Talk notice live simple environmental business least Democrat forward certain buy turn business. Food was cold Food was cold Food was cold,1.9,-3
2542,Stay at card example color exactly trial election. Great service Great service Great service,2.2,0
2543,Vote moment development fish about smile sure growth impact resource room stuff. Food was cold Food was cold Food was cold,3.1,-2
2544,Rate them ok across close message natural laugh. Driver was polite Driver was polite Driver was polite,4,3
2545,Anything benefit probably research newspaper soldier. Awful delay Awful delay Awful delay,1.4,-5
2546,Resource woman high well include thank camera daughter difficult better however collection. Driver was polite Driver was polite Driver was polite,1.7,2
2547,Step policy money policy source old through manage activity figure board person age. Great service Great service Great service,2.5,0
2548,Fish cover skill thank civil report system. Great service Great service Great service,1.1,1
2549,Above night land type stand argue final save behavior run. Driver was polite Driver was polite Driver was polite,1.2,3
2550,Treat child own whole soon game within. The delivery was fast! The delivery was fast! The delivery was fast!,4.9,3
2551,Base risk from industry sing now smile which total child. Awful delay Awful delay Awful delay,3.4,-6
2552,Your pressure me peace need after bar employee. Great service Great service Great service,1.9,1
2553,Box recent recent fly response air like artist. The delivery was fast! The delivery was fast! The delivery was fast!,2.9,3
2554,Itself certainly thus carry on thank central music. Great service Great service Great service,4.4,0
2555,Green tend baby happen trip main. The delivery was fast! The delivery was fast! The delivery was fast!,1.7,3
2556,Last concern practice yard artist project plan prove which level message. The delivery was fast! The delivery was fast! The delivery was fast!,1.9,2
2557,Win travel believe reduce agreement part prevent finally outside rock. Highly recommend Highly recommend Highly recommend,1.1,4
2558,Employee throughout business hand then accept grow PM throw stage power writer side. Highly recommend Highly recommend Highly recommend,2.7,3
2559,Not cover season cause Democrat structure huge message into. Driver was polite Driver was polite Driver was polite,3.3,3
2560,Amount surface guy occur character less ever team finally significant away room place. Highly recommend Highly recommend Highly recommend,4.7,4
2561,Front increase sister her scene eight. Food was cold Food was cold Food was cold,3.6,-3
2562,Spend meeting serious everybody put determine run. Highly recommend Highly recommend Highly recommend,1.6,3
2563,It PM under quality while allow stock. Driver was polite Driver was polite Driver was polite,4.7,3
2564,Suffer usually case music quickly word soon growth check almost traditional. Great service Great service Great service,2.7,-1
2565,Artist staff time cut government point fact successful store. Great service Great service Great service,1.1,1
2566,Rather say agent consider mission find anyone. Great service Great service Great service,4.3,0
2567,Prove some truth crime attack part we whose not. Highly recommend Highly recommend Highly recommend,4.4,1
2568,Put describe side move nature citizen contain none of computer artist. Great service Great service Great service,3.9,0
2569,Each player learn pass describe among participant often trial. Food was cold Food was cold Food was cold,3.8,-3
2570,Newspaper within case memory miss floor lot. Driver was polite Driver was polite Driver was polite,3.9,2
2571,Machine Mr party they she hotel mean. Food was cold Food was cold Food was cold,4.4,-3
2572,Reach suggest none major fact stand list. Driver was polite Driver was polite Driver was polite,2.7,3
2573,Case collection few public almost example bank wonder against then executive. Great service Great service Great service,1.1,0
2574,Yet choose reflect number near provide day. The delivery was fast! The delivery was fast! The delivery was fast!,2.5,3
2575,Happen challenge action everyone high last. Great service Great service Great service,1.9,0
2576,Defense education official clear crime answer. Awful delay Awful delay Awful delay,1.1,-7
2577,He strong push debate school generation worry with record break front there. Awful delay Awful delay Awful delay,2.4,-7
2578,Agree recognize for tax single authority general down suffer system without story. Awful delay Awful delay Awful delay,2.2,-7
2579,Arrive night skill account national perform war produce. Food was cold Food was cold Food was cold,2.2,-2
2580,Attention cost ball street include or energy wind civil type forward real similar. Driver was polite Driver was polite Driver was polite,1.9,3
2581,Suggest must yeah idea just citizen research finish drive radio home Democrat. Great service Great service Great service,3.9,0
2582,Central hear check population commercial perform too condition hard. Driver was polite Driver was polite Driver was polite,2.9,2
2583,Environment work whatever born add candidate money. Awful delay Awful delay Awful delay,1.6,-6
2584,Black explain no tax message alone many put return serious throw example. Driver was polite Driver was polite Driver was polite,4.2,3
2585,Need film ago while actually more reality capital any popular exist or. The delivery was fast! The delivery was fast! The delivery was fast!,2.6,4
2586,Amount amount month most center blue later hit recent safe artist. Driver was polite Driver was polite Driver was polite,1.4,4
2587,Here agent together into anything agreement without religious institution move something throughout. The delivery was fast! The delivery was fast! The delivery was fast!,2.7,3
2588,Buy ago heart hair require recognize note. Food was cold Food was cold Food was cold,3.3,-3
2589,At media bit purpose threat avoid end too what contain public street play. Awful delay Awful delay Awful delay,3.2,-7
2590,Offer despite however later east stuff place eye director free billion lose. The delivery was fast! The delivery was fast! The delivery was fast!,3.6,3
2591,Decide dog between training research many offer than make process however. Great service Great service Great service,1.8,0
2592,Evening color receive order pressure attention night share. Driver was polite Driver was polite Driver was polite,2.6,3
2593,Market hard of whatever somebody ball. Awful delay Awful delay Awful delay,4,-7
2594,Letter beautiful decision onto alone attention. Food was cold Food was cold Food was cold,4.7,-2
2595,Special federal road situation easy may bed deal. Food was cold Food was cold Food was cold,3.9,-2
2596,Bank young appear their individual rest. Great service Great service Great service,1.9,0
2597,College property base stuff current produce leg over follow manage knowledge clearly six. Awful delay Awful delay Awful delay,4.9,-6
2598,Great able kid current better three. Great service Great service Great service,4.9,0
2599,Prevent two bag weight five station nothing team think raise head. Great service Great service Great service,1.7,0
2600,Ok wide off exactly course without common decade recognize. Driver was polite Driver was polite Driver was polite,2.1,3
2601,Effort certainly work black thank table food data sport why since. Highly recommend Highly recommend Highly recommend,2.2,3
2602,Skin exactly war manage goal magazine role create simple role before. Awful delay Awful delay Awful delay,4.4,-6
2603,Rise event themselves popular hair improve thank record upon article. Awful delay Awful delay Awful delay,4.1,-4
2604,Third drug other husband role happy agree likely physical own site. Awful delay Awful delay Awful delay,3.7,-5
2605,Lot politics seat red within so begin water. Driver was polite Driver was polite Driver was polite,4.4,3
2606,Series senior stand cup thank successful above right push. The delivery was fast! The delivery was fast! The delivery was fast!,1.7,4
2607,Big degree director serious collection season develop car game rule teacher behavior country. Highly recommend Highly recommend Highly recommend,4.9,3
2608,Report reality without religious trial challenge PM figure. The delivery was fast! The delivery was fast! The delivery was fast!,2.3,3
2609,School approach thank offer occur as wind provide week gun. Food was cold Food was cold Food was cold,3.2,-3
2610,Wall side prepare with purpose know. Highly recommend Highly recommend Highly recommend,2.3,3
2611,Size hotel market take list yeah this but certainly occur hot fund. Food was cold Food was cold Food was cold,1.1,-2
2612,Bring training source certainly movement same create line police at. Driver was polite Driver was polite Driver was polite,4.4,3
2613,Close draw worry research start own maintain central. Food was cold Food was cold Food was cold,2.3,-4
2614,International image actually production American positive business no form bag view describe natural. Food was cold Food was cold Food was cold,3.9,-2
2615,Perhaps individual news late if arm natural ever leg value. The delivery was fast! The delivery was fast! The delivery was fast!,1.7,3
2616,North onto include determine time body within class force series follow. Awful delay Awful delay Awful delay,2.9,-6
2617,Onto animal far attention your Mrs sell choose must debate. Driver was polite Driver was polite Driver was polite,1,3
2618,Arrive local almost image arrive quickly kid trade. Highly recommend Highly recommend Highly recommend,2,3
2619,Authority sport may whether attack sister certainly image feeling determine day travel how. Food was cold Food was cold Food was cold,3.6,-4
2620,Protect red about begin keep fall soon collection quickly. Food was cold Food was cold Food was cold,1.5,-3
2621,Relationship become catch himself need wrong. Highly recommend Highly recommend Highly recommend,3.4,2
2622,Reach hotel trial international modern security analysis especially age. Driver was polite Driver was polite Driver was polite,2.6,4
2623,Third let page result organization admit perform me still contain. Awful delay Awful delay Awful delay,1.4,-6
2624,Do international always of place find know. Great service Great service Great service,4,0
2625,General their administration still act heavy north audience business big position. The delivery was fast! The delivery was fast! The delivery was fast!,1.9,3
2626,Majority analysis up bill audience news trial. Highly recommend Highly recommend Highly recommend,2.3,3
2627,Stand interesting college attention stage require produce. Highly recommend Highly recommend Highly recommend,3.2,3
2628,From condition strategy every develop sport get act whether understand get. Highly recommend Highly recommend Highly recommend,1.8,3
2629,Congress purpose explain news generation experience mother past. Highly recommend Highly recommend Highly recommend,1.1,3
2630,Eye real prove almost provide area animal quite sense such trial. Great service Great service Great service,4,0
2631,Where even position daughter life thus assume lawyer increase across range. Awful delay Awful delay Awful delay,1.7,-6
2632,Top forget center care general guess research now house order language how computer. The delivery was fast! The delivery was fast! The delivery was fast!,4.6,4
2633,Run industry performance less possible people never safe. Driver was polite Driver was polite Driver was polite,4.4,4
2634,Guess offer on day hear force year indeed really religious country election media. Food was cold Food was cold Food was cold,4.7,-3
2635,Bad reflect president top listen shake than network window effect next late six. Awful delay Awful delay Awful delay,3.8,-7
2636,Fire with thank direction pull central tend here quality choice east total. Driver was polite Driver was polite Driver was polite,4.2,3
2637,Relationship just throw goal well reveal kind look for station. Driver was polite Driver was polite Driver was polite,4,3
2638,Foreign black image there worker last fall. Driver was polite Driver was polite Driver was polite,3.8,2
2639,Gas collection article back specific view. Driver was polite Driver was polite Driver was polite,1.7,3
2640,Bill sit office nothing rock information ever goal reduce physical if environmental. Highly recommend Highly recommend Highly recommend,3.2,3
2641,Game or choice however nothing require charge move executive senior soon another. Great service Great service Great service,3.4,0
2642,Animal difference you political if life decide who. Great service Great service Great service,4.2,0
2643,Know discover try decision exactly eat understand some happy. Great service Great service Great service,3.7,1
2644,Hotel possible special response resource right raise tax stay staff. The delivery was fast! The delivery was fast! The delivery was fast!,2.1,3
2645,Toward enjoy model with mean current two air one law. Food was cold Food was cold Food was cold,2.7,-2
2646,Morning physical court he talk cultural late note piece writer use. Driver was polite Driver was polite Driver was polite,3.1,3
2647,His network their allow tell event the land. Driver was polite Driver was polite Driver was polite,3.7,3
2648,Large Congress week type call town first some while nor officer himself. The delivery was fast! The delivery was fast! The delivery was fast!,5,3
2649,Again mind tend yard trip fund agree account thought serve let cold explain. The delivery was fast! The delivery was fast! The delivery was fast!,3.5,2
2650,Protect rather toward probably word large run bed total material. Food was cold Food was cold Food was cold,3.4,-2
2651,Detail mind arm fear born story store state often. Great service Great service Great service,4.1,-1
2652,Half discover develop entire along common field tonight pattern. Awful delay Awful delay Awful delay,2.7,-6
2653,Speak spend network surface question money political great. Great service Great service Great service,2.4,0
2654,Age support summer use send manage anything time. Awful delay Awful delay Awful delay,3.6,-5
2655,Standard source give see help hope. Food was cold Food was cold Food was cold,5,-3
2656,Focus leave successful way effect peace. Great service Great service Great service,4.1,2
2657,Different nation voice month try she body much your bill ok minute discussion. Great service Great service Great service,3.1,0
2658,Speech soldier safe local race reach various money third. Highly recommend Highly recommend Highly recommend,1.2,4
2659,Few control analysis however help type car tell. Great service Great service Great service,1.2,0
2660,Few investment individual money our after shoulder amount much safe religious avoid crime. Driver was polite Driver was polite Driver was polite,3,3
2661,Say country sing office price week girl treat. Food was cold Food was cold Food was cold,4.9,-3
2662,Sister east white hope pull ability space teacher lot hair officer order. Awful delay Awful delay Awful delay,4.7,-6
2663,Process out recently officer understand pull pretty quickly high today trouble. Highly recommend Highly recommend Highly recommend,1.7,3
2664,South however church thank clear white make. Awful delay Awful delay Awful delay,1.3,-6
2665,Develop ready receive enough another oil change situation other. Great service Great service Great service,4.6,1
2666,Rise fire after probably when mother reality behind institution military white over discuss. The delivery was fast! The delivery was fast! The delivery was fast!,2.4,3
2667,Woman good local use address why easy home. The delivery was fast! The delivery was fast! The delivery was fast!,1.5,4
2668,Rock language ground second agreement public control. Driver was polite Driver was polite Driver was polite,3.6,3
2669,Property site us most response shoulder different. Awful delay Awful delay Awful delay,1.9,-6
2670,System value five staff present respond officer. Driver was polite Driver was polite Driver was polite,2.7,3
2671,Yet method need defense every place itself capital nice. The delivery was fast! The delivery was fast! The delivery was fast!,2.8,4
2672,Laugh third top organization career across practice cut hour level. Food was cold Food was cold Food was cold,4.4,-2
2673,Boy up become authority recognize Congress class draw successful door hope talk identify. Food was cold Food was cold Food was cold,2.1,-2
2674,Old very financial popular them perhaps trouble real plant idea. Great service Great service Great service,2.6,0
2675,Almost my population add drug book push people get. Food was cold Food was cold Food was cold,4.3,-3
2676,Simply room force move attorney development. Great service Great service Great service,4.6,0
2677,Stock foot per director become issue country myself blue. Great service Great service Great service,3.3,-1
2678,Stock view once card herself place. The delivery was fast! The delivery was fast! The delivery was fast!,1.4,3
2679,Power wrong hot step professional rate position. The delivery was fast! The delivery was fast! The delivery was fast!,4.8,3
2680,Finally kid public once race people performance bank really away power particularly. Awful delay Awful delay Awful delay,3.4,-6
2681,Author customer face despite its year chance young bring may current leader whether either. Great service Great service Great service,4.5,0
2682,Investment under operation point like charge. The delivery was fast! The delivery was fast! The delivery was fast!,2.9,3
2683,Eat last white friend deal return magazine be music. The delivery was fast! The delivery was fast! The delivery was fast!,4.1,3
2684,As authority will eye religious near blue. Great service Great service Great service,4.8,0
2685,Story often green author then Mr. Awful delay Awful delay Awful delay,2.8,-6
2686,Require account money series light news wonder board. Great service Great service Great service,1.4,0
2687,Some long suddenly war whether treat work including. Great service Great service Great service,4.4,0
2688,Car carry address skill though shoulder perhaps sound. Driver was polite Driver was polite Driver was polite,1.5,4
2689,Ago follow send training lay blood black them always. Awful delay Awful delay Awful delay,3,-6
2690,Five young mission senior man eye. Driver was polite Driver was polite Driver was polite,1.2,3
2691,Government together police go consumer pay car floor political Congress woman machine. The delivery was fast! The delivery was fast! The delivery was fast!,1.7,3
2692,Herself southern boy church artist new here program build. Food was cold Food was cold Food was cold,4.4,-3
2693,Central night before work drive box situation however nature eight every good thought. Awful delay Awful delay Awful delay,2.2,-6
2694,Congress avoid song north audience traditional moment. Great service Great service Great service,2.2,0
2695,Prove north city perform class total move court result heavy. Driver was polite Driver was polite Driver was polite,3.9,3
2696,Action my daughter product indicate national late. Highly recommend Highly recommend Highly recommend,1.4,3
2697,Language group natural pressure dog wait. Food was cold Food was cold Food was cold,4.8,-3
2698,Education worker magazine chance think exist dog recently now three lay high surface. Great service Great service Great service,2.8,0
2699,Hospital wall avoid market seek season. Driver was polite Driver was polite Driver was polite,2.7,3
2700,Relationship so off police three yeah light maintain involve note. Driver was polite Driver was polite Driver was polite,4.9,3
2701,Or piece ground down green learn ready best suddenly role consider friend. The delivery was fast! The delivery was fast! The delivery was fast!,2.3,4
2702,Camera amount trade up yard figure one material hundred government. Food was cold Food was cold Food was cold,2.8,-3
2703,Environmental prove research half poor clear piece market somebody. The delivery was fast! The delivery was fast! The delivery was fast!,1.3,2
2704,If ago kid including use expert yes suffer. Great service Great service Great service,1.9,-1
2705,May economy management sure themselves benefit upon let buy. Driver was polite Driver was polite Driver was polite,2.8,4
2706,Radio lay good late produce city his series lay too husband what force. Awful delay Awful delay Awful delay,4.3,-6
2707,Foreign brother American just technology four toward too like world discuss leg wrong. Highly recommend Highly recommend Highly recommend,2.6,2
2708,Growth guess claim pressure my push accept success member. Highly recommend Highly recommend Highly recommend,3.6,4
2709,Director from sense yet memory consider red design but base message mean. Food was cold Food was cold Food was cold,2.8,-3
2710,Low management husband soon good ground head choice father. Food was cold Food was cold Food was cold,1.3,-3
2711,Vote activity organization stay her writer simple scientist know return little. Food was cold Food was cold Food was cold,3.1,-3
2712,Prevent appear analysis general good use moment song. The delivery was fast! The delivery was fast! The delivery was fast!,3.8,3
2713,Audience week example end government month building true. Driver was polite Driver was polite Driver was polite,2.6,3
2714,Until four easy on clearly phone yet list system political could last. Great service Great service Great service,2.8,1
2715,Fear foot million law above stop themselves perform begin trouble table account. Awful delay Awful delay Awful delay,1.1,-8
2716,Put product suddenly bring treatment reach white upon suddenly become system decade within. Driver was polite Driver was polite Driver was polite,4.8,3
2717,Plan health lead community card possible. Driver was polite Driver was polite Driver was polite,1.8,4
2718,Start woman tax we red face mother ball lawyer. Food was cold Food was cold Food was cold,1.9,-3
2719,Require wait must type ground bad decision. Highly recommend Highly recommend Highly recommend,2.8,2
2720,Trouble begin song soldier allow left rock first want range because business. Awful delay Awful delay Awful delay,4.7,-7
2721,And forget tough or environmental catch. Food was cold Food was cold Food was cold,4.9,-2
2722,Operation peace class pattern certainly affect throughout car town human money image. Highly recommend Highly recommend Highly recommend,4.8,4
2723,Rather notice provide suffer traditional push score behavior discuss school sometimes. Great service Great service Great service,2.7,-1
2724,Could between involve manage thing whose gas whom list thus clear law. Driver was polite Driver was polite Driver was polite,2.4,3
2725,Main despite nothing perform seven why. Awful delay Awful delay Awful delay,3.1,-6
